,word,number,original_words
24,spra,25,"sprawy, sprawy, sprawy, sprawdzą, sprawdzamy, sprawą, sprawdzamy, sprawą, sprawdzał, sprawą, sprawę, sprawa, sprawdziliśmy, sprawdzania, sprawiedliwość, sprawą, sprawę, sprawę, sprawę, sprawdziliśmy, sprawa, sprawności, sprawą, sprawę, spraw"
54,dwa,25,"dwa, dwa, dwa, dwa, dwa, dwa, dwa, dwa, dwa, dwa, dwa, dwa, dwa, dwa, dwa, dwa, dwa, dwa, dwa, dwa, dwa, dwa, dwa, dwa, dwa"
288,wspó,25,"współpracowników, współpracownik, współpracownik, współpracownik, współpracownik, współpracy, wspólna, współpracowników:, wspólna, współpracowników:, wspólna, współpracowników:, wspólna, współpracowników:, wspólna, współpracowników:, wspólna, współpracowników:, współpracowników, współpraca, współpraca, współpraca, wspólna, wspólne, wspólnego"
745,czar,25,"czarnka, czarnka, czarnek, czarną, czarnka, czarnka, czarnka, czarnka, czarnek, czarnka, czarnka, czarnka, czarnka, czarnka, czarnka, czarnka, czarnek:, czarnek, czarnka, czarnka, czarnka, czarnka:, czarnka, czarnka, czarnek"
236,pogo,25,"pogoda, pogoda, pogoda, pogody, pogody, pogody, pogody, pogody, pogody, pogodą, pogodzie, pogodą, pogody, pogotowie, pogoda, pogoda, pogodę, pogoda, pogodę, pogorszył, pogoda, pogoda, pogoda, pogoda, pogody"
82,gran,25,"granerud, granic:, granic:, granicy, granatniku, granic, granic, granic, granic, granic, granic, granatnikiem, granic, granicę, granicę, graneruda, granicznych, granicy, granicy, granicy, granicę, granicą, graneruda, granice, granicy"
310,osób,25,"osób, osób, osób, osób, osób, osób, osób, osób, osób, osób, osób, osób, osób, osób, osób, osób, osób, osób, osób, osób, osób, osób, osób, osób, osób"
1094,kacz,25,"kaczyński, kaczyński, kaczyński, kaczyński, kaczyński, kaczyński, kaczyńskiego, kaczyński, kaczyński, kaczyński, kaczyński, kaczyński, kaczyński, kaczyńskim, kaczyńskiego, kaczyńskiego:, kaczyńskiego, kaczyński, kaczyńskiego, kaczyńskim, kaczyńskiemu, kaczka, kaczyński, kaczyńskiego, kaczyński"
57,pona,25,"ponad, ponad, ponad, ponad, ponad, ponad, ponad, ponad, ponad, ponad, ponad, ponad, ponad, ponad, ponad, ponad, ponad, ponad, ponad, ponad, ponad, ponad, ponad, ponad, ponad"
428,usa,24,"usa, usa, usa, usa, usa, usa, usa, usa, usa, usa, usa, usa, usa, usa, usa, usa, usa, usa, usa, usa, usa, usa, usa, usa"
15,zacz,24,"zaczęły, zaczyna, zaczęły, zaczyna, zaczyna, zaczyna, zaczynają, zaczynają, zaczynają, zaczynają, zaczynają, zaczynają, zaczęła, zaczynam, zaczęła, zaczęło, zaczynał, zaczynał, zaczynał, zaczął, zaczęło, zaczęły, zacznie, zaczęli"
1108,joe,24,"joe, joe, joe, joe, joe, joe, joe, joe, joe, joe, joe, joe, joe, joe, joe, joe, joe, joe, joe, joe, joe, joe, joe, joe"
732,dost,24,"dostał, dostali, dostać, dostrzega, dostała, dostać, dostali, dostanie, dostały, dostały, dostały, dostajesz, dostępu, dostanie, dostarczanie, dostarczanie, dostarczanie, dostał, dostawy, dostał, dostawy, dostaliśmy, dostarczy, dostaję"
904,rząd,24,"rządu, rządzących, rządu, rządzących, rządu, rządzących, rządu, rządzących, rządu, rządzących, rządu, rządzących, rządu, rząd, rządu, rząd, rządzie, rząd, rząd, rządu, rządowego, rządu, rządowych, rządu"
473,kont,24,"kontroli, kontroli, kontynuowanie, kontrterroryści, kontrterroryści, kontrterroryści, kontrterroryści, kontrterroryści, kontrterroryści, kontaktowego, kontrolę, kontaktowego, kontroli, kontrataku, kontra, kontrowersyjny, kontrola, kontenerowy, kontroli, kontrola, kontra, kontynentów, kontenerowiec, kontrowersyjna"
239,ostr,23,"ostrzega, ostrzega, ostrzega, ostrzał, ostrzał, ostrzał, ostrzał, ostrzeżenie, ostrzegają, ostrożność, ostrzega, ostrą, ostrzeżeniami, ostrzeżenia, ostrzeżenie, ostrzega, ostrzega, ostrzegają, ostrzegania, ostrzegania, ostrzał, ostrzału, ostrzał"
651,kier,23,"kierowca, kierunki, kierunków, kieruję, kierowca, kierownicą, kierunku, kierowcy, kierowców, kierowców, kierownictwa, kierunku, kierunek, kierownictwa, kierunku, kierunek, kierownictwa, kierunku, kierunek, kierunku, kierowcy, kierunków, kierunki"
767,czas,23,"czasu, czasów, czasów, czasów, czasów, czasów, czasów, czasów, czas, czasie, czas, czas, czas, czas, czasie, czasie, czasem, czas, czasów, czas, czas, czas, czas"
183,licz,22,"liczba, liczba, liczą, liczba, liczba, liczba, liczba, liczba, liczba, liczba, liczenie, liczyłam, liczby, liczba, liczby, liczby, liczbę, liczbę, liczbę, liczby, liczyć, liczba"
178,zagr,22,"zagrożeniem, zagrożeniem, zagrożeni, zagrożeni, zagrożeni, zagrożeni, zagrody, zagranie, zagranicznych, zagrożeń, zagrają, zagrożony, zagryziona, zagra, zagrożone, zagrali, zagrzewa, zagrażają, zagrażają, zagraża, zagranicy, zagraniem"
619,aust,22,"australian, australian, australian, australian, australian, australian, australian, australian, australian, australian, australian, australian, australian, australian, australian, australian, australian, australian, australian, austrii, austrii, austrii"
94,pańs,22,"państw, państw, państwowej, państwo, państw, państw, państw, państw, państw, państw, państwie, państwie, państwo, państwu, państwo, państwowa, państwu, państwa, państw, państwowych, państwa, państwo"
143,czy,22,"czy, czy, czy, czy, czy, czy, czy, czy, czy, czy, czy, czy, czy, czy, czy, czy, czy, czy, czy, czy, czy, czy"
375,mies,22,"mieszkańcy, mieszkańcy, mieszkańcy, mieszkańców, mieszkańcy, mieszkańców, mieszkańcy, mieszkańców, mieszkańcy, mieszkańców, mieszkań, mieszkaniu, mieszkalną, miesiące, miesiąc, miesięcy, mieszkaniem, mieszkania, miesiące, mieszczą, mieszkańców, mieszkania"
222,znal,22,"znaleźli, znaleźli, znalazła, znaleźli, znaleźli, znaleziono, znalazł, znalezione, znalazła, znaleźli, znalezione, znaleziono, znalezione, znaleziono, znali, znaleziono, znali, znaleziono, znali, znaleziony, znaleziska, znaleźli"
297,szpi,22,"szpitala, szpiegów, szpiegowską, szpiegowska, szpiegowska, szpiegowska, szpiegowska, szpiegowska, szpiegowska, szpitala, szpiegowski, szpiegowski, szpital, szpiegowskich, szpitala, szpitala, szpitala, szpiegów, szpitalu, szpitalu, szpitala, szpitalu"
112,pomo,21,"pomoc, pomocy, pomocy, pomocy, pomocy, pomocy, pomocy, pomocy, pomoc, pomocy, pomogła, pomoc, pomoc, pomoc, pomoc, pomocy, pomoc, pomocy, pomoc, pomocy, pomoc"
225,chci,21,"chciałem, chciałem, chciał, chciał, chciwość, chciwość, chciwość, chciwość, chciwość, chciwość, chciał, chciałbym, chciałabym, chciała, chciała, chciał, chciał, chciał, chciał, chciałbym, chciałabym"
301,plan,21,"planuje, planie, planie, planie, planie, planie, planie, plan, planuje, planety, planicy, planach, planowanego, planach, plan, plan, plan, plan, planet, planicy, planom"
22,auto,21,"autorytaryzmu, autorytaryzmu, autobusów, autostradą, autostradach, auto, auto, autografem, autokar, autostradzie, autobus, auto, automatyczny, autostrady, autobusy, autobusy, autobusy, autobusu, autobusami, autobus, auto"
893,ciał,21,"ciała, ciał, ciał, ciał, ciał, ciał, ciał, ciała, ciała, ciała, ciał, ciało, ciało, ciała, ciała, ciała, ciała, ciał, ciało, ciała, ciało"
971,drug,21,"drugich, drugi, drugi, drugi, drugi, drugi, drugi, drugi, drugi, drugi, drugi, drugie, drugi, drugi, drugą, drugi, drugiego, druga, druga, druga, druga"
132,ważn,21,"ważny, ważny, ważne, ważne, ważne, ważne, ważne, ważne, ważne, ważne, ważniejszy, ważny, ważna, ważny, ważne, ważna, ważnego, ważna, ważna, ważna, ważna"
1516,plus,21,"plus, plus, plus, plus, plus, plus, plus, plus, plus, plus, plus, plus, plus, plus, plus, plus, plus, plus, plus, plus, plus"
720,służ,21,"służbie, służby, służą, służyć, służb, służyć, służb, służyć, służb, służyć, służb, służyć, służb, służyć, służb, służb, służył, służby, służby, służby, służy"
880,ares,20,"aresztował, aresztu, aresztowanego:, aresztu, aresztowanego:, aresztu, aresztowanego:, aresztu, aresztowanego:, aresztu, aresztowanego:, aresztu, aresztowanego:, aresztu, aresztem, areszcie, areszt, aresztu, aresztu, aresztowanie"
235,nieb,20,"niebezpieczna, niebezpieczna, niebezpieczeństwie, niebie, niebezpieczną, nieba, niebezpieczni, niebezpieczny, niebezpieczną, niebezpieczne, niebezpiecznych, niebezpiecznie, niebie, niebie, niebo, niebezpieczny, niebezpieczne, niebezpieczne, niebie, niebezpiecznie"
704,roku,20,"roku, roku, roku, roku, roku, roku, roku, roku, roku, roku, roku, roku, roku, roku, roku, roku, roku, roku, roku, roku"
191,kto,20,"kto, kto, kto, kto, kto, kto, kto, kto, kto, kto, kto, kto, kto, kto, kto, kto, kto, kto, kto, kto"
426,mnie,20,"mnie, mnie, mniejszości, mnie, mniejsze, mnie, mnie, mnie, mniej, mnie, mnie, mniej, mnie, mnie, mniej, mnie, mnie, mnie, mnie, mnie"
