,word,number,original_words
146,trze,28,"trzeba, trzema, trzeciego, trzeba, trzeba, trzeba, trzeba, trzeba, trzeba, trzeba, trzeba, trzeba, trzecią, trzeci, trzeci, trzeba, trzeba, trzeciego, trzeba, trzech, trzecia, trzecia, trzecia, trzech, trzeba, trzeba, trzeba, trzeba"
7,być,28,"być, być, być, być, być, być, być, być, być, być, być, być, być, być, być, być, być, być, być, być, być, być, być, być, być, być, być, być"
296,traf,28,"trafiło, trafił, trafili, trafili, trafili, trafili, trafili, trafili, trafiła, trafiono, trafiły, trafi, trafić, trafił, trafi, trafiały, trafi, trafił, trafi, trafił, trafiła, trafił, trafiła, trafił, trafiła, trafiła, trafić, trafia"
201,wojn,27,"wojnę, wojny, wojnę, wojny, wojny, wojny, wojnę, wojny, wojny, wojny, wojny, wojny, wojny, wojna, wojny, wojnę, wojny, wojny, wojnę, wojnowicach, wojna, wojnie, wojny, wojnę, wojny, wojny, wojnę"
358,nies,27,"niespodziewane, niesamowity, niesprawiedliwe, niestety, niesamowity, niesprawiedliwe, niestety, niesamowity, niesprawiedliwe, niestety, niesamowity, niesprawiedliwe, niestety, niesamowity, niesprawiedliwe, niestety, niesamowity, niesprawiedliwe, niestety, niesamowita, nieszczęście, nieszczęśliwy, niesmak, niestandardowa, niespłacony, niespodziewana, niesławnej"
24,spra,27,"sprawy, sprawy, sprawy, sprawdzą, sprawdzamy, sprawą, sprawdzamy, sprawą, sprawdzał, sprawą, sprawę, sprawa, sprawdziliśmy, sprawdzania, sprawiedliwość, sprawą, sprawę, sprawę, sprawę, sprawdziliśmy, sprawa, sprawności, sprawą, sprawę, spraw, sprawę, sprawca"
745,czar,27,"czarnka, czarnka, czarnek, czarną, czarnka, czarnka, czarnka, czarnka, czarnek, czarnka, czarnka, czarnka, czarnka, czarnka, czarnka, czarnka, czarnek:, czarnek, czarnka, czarnka, czarnka, czarnka:, czarnka, czarnka, czarnek, czarnek, czarnek"
479,pode,27,"podejrzewanego, podejrzanych, podejrzewali, podejrzani, podejrzani, podejrzanego, podejrzani, podejrzanego, podejrzani, podejrzanego, podejrzani, podejrzanego, podejrzani, podejrzanego, podejrzani, podejrzanego, podejmuje, podejrzewaną, podejrzany, podejrzewanego, podejrzewa, podejrzany, poderwane, podejrzewanego, poderwali, podejrzewał, podeszła"
767,czas,27,"czasu, czasów, czasów, czasów, czasów, czasów, czasów, czasów, czas, czasie, czas, czas, czas, czas, czasie, czasie, czasem, czas, czasów, czas, czas, czas, czas, czas, czasem, czasem, czasach"
742,will,26,"willę, willi, willa, willa, willa, willingen, willa, willa, willingen, willa, willa, wille, willa, willa, willę, willisa:, willi, willa, willa, willa, willa, willa, willa, willa, willa, willa"
732,dost,26,"dostał, dostali, dostać, dostrzega, dostała, dostać, dostali, dostanie, dostały, dostały, dostały, dostajesz, dostępu, dostanie, dostarczanie, dostarczanie, dostarczanie, dostał, dostawy, dostał, dostawy, dostaliśmy, dostarczy, dostaję, dostali, dostawa"
375,mies,26,"mieszkańcy, mieszkańcy, mieszkańcy, mieszkańców, mieszkańcy, mieszkańców, mieszkańcy, mieszkańców, mieszkańcy, mieszkańców, mieszkań, mieszkaniu, mieszkalną, miesiące, miesiąc, miesięcy, mieszkaniem, mieszkania, miesiące, mieszczą, mieszkańców, mieszkania, miesiąc, miesięcy, mieszkań, miesięcy"
574,wizy,26,"wizyta, wizyta, wizyta, wizyta, wizyta, wizycie, wizyty, wizyta, wizyty, wizyty, wizyty, wizytą, wizyta, wizyta, wizyty, wizyta, wizyta, wizytę, wizyty, wizyta, wizycie, wizytę, wizyty, wizyty, wizytę, wizycie"
60,zatr,26,"zatrzymali, zatrzymali, zatrzymało, zatrzymana, zatrzymaniu, zatrzymania, zatrzymania, zatrzymania, zatrzymania, zatrzymania, zatrzymania, zatrzymać, zatrzymany, zatrzęsło, zatrucie, zatrutym, zatrzymał, zatrzymała, zatrzęsła, zatrzęsła, zatrzymano, zatrucia, zatrzymała, zatrzymanie, zatrzymało, zatrzymania"
82,gran,26,"granerud, granic:, granic:, granicy, granatniku, granic, granic, granic, granic, granic, granic, granatnikiem, granic, granicę, granicę, graneruda, granicznych, granicy, granicy, granicy, granicę, granicą, graneruda, granice, granicy, granic:"
57,pona,26,"ponad, ponad, ponad, ponad, ponad, ponad, ponad, ponad, ponad, ponad, ponad, ponad, ponad, ponad, ponad, ponad, ponad, ponad, ponad, ponad, ponad, ponad, ponad, ponad, ponad, ponad"
54,dwa,26,"dwa, dwa, dwa, dwa, dwa, dwa, dwa, dwa, dwa, dwa, dwa, dwa, dwa, dwa, dwa, dwa, dwa, dwa, dwa, dwa, dwa, dwa, dwa, dwa, dwa, dwa"
651,kier,26,"kierowca, kierunki, kierunków, kieruję, kierowca, kierownicą, kierunku, kierowcy, kierowców, kierowców, kierownictwa, kierunku, kierunek, kierownictwa, kierunku, kierunek, kierownictwa, kierunku, kierunek, kierunku, kierowcy, kierunków, kierunki, kierowcy, kierowców, kierunek"
1094,kacz,25,"kaczyński, kaczyński, kaczyński, kaczyński, kaczyński, kaczyński, kaczyńskiego, kaczyński, kaczyński, kaczyński, kaczyński, kaczyński, kaczyński, kaczyńskim, kaczyńskiego, kaczyńskiego:, kaczyńskiego, kaczyński, kaczyńskiego, kaczyńskim, kaczyńskiemu, kaczka, kaczyński, kaczyńskiego, kaczyński"
236,pogo,25,"pogoda, pogoda, pogoda, pogody, pogody, pogody, pogody, pogody, pogody, pogodą, pogodzie, pogodą, pogody, pogotowie, pogoda, pogoda, pogodę, pogoda, pogodę, pogorszył, pogoda, pogoda, pogoda, pogoda, pogody"
288,wspó,25,"współpracowników, współpracownik, współpracownik, współpracownik, współpracownik, współpracy, wspólna, współpracowników:, wspólna, współpracowników:, wspólna, współpracowników:, wspólna, współpracowników:, wspólna, współpracowników:, wspólna, współpracowników:, współpracowników, współpraca, współpraca, współpraca, wspólna, wspólne, wspólnego"
310,osób,25,"osób, osób, osób, osób, osób, osób, osób, osób, osób, osób, osób, osób, osób, osób, osób, osób, osób, osób, osób, osób, osób, osób, osób, osób, osób"
143,czy,24,"czy, czy, czy, czy, czy, czy, czy, czy, czy, czy, czy, czy, czy, czy, czy, czy, czy, czy, czy, czy, czy, czy, czy, czy"
1108,joe,24,"joe, joe, joe, joe, joe, joe, joe, joe, joe, joe, joe, joe, joe, joe, joe, joe, joe, joe, joe, joe, joe, joe, joe, joe"
132,ważn,24,"ważny, ważny, ważne, ważne, ważne, ważne, ważne, ważne, ważne, ważne, ważniejszy, ważny, ważna, ważny, ważne, ważna, ważnego, ważna, ważna, ważna, ważna, ważnym, ważną, ważne"
428,usa,24,"usa, usa, usa, usa, usa, usa, usa, usa, usa, usa, usa, usa, usa, usa, usa, usa, usa, usa, usa, usa, usa, usa, usa, usa"
15,zacz,24,"zaczęły, zaczyna, zaczęły, zaczyna, zaczyna, zaczyna, zaczynają, zaczynają, zaczynają, zaczynają, zaczynają, zaczynają, zaczęła, zaczynam, zaczęła, zaczęło, zaczynał, zaczynał, zaczynał, zaczął, zaczęło, zaczęły, zacznie, zaczęli"
183,licz,24,"liczba, liczba, liczą, liczba, liczba, liczba, liczba, liczba, liczba, liczba, liczenie, liczyłam, liczby, liczba, liczby, liczby, liczbę, liczbę, liczbę, liczby, liczyć, liczba, liczyć, liczbach"
94,pańs,24,"państw, państw, państwowej, państwo, państw, państw, państw, państw, państw, państw, państwie, państwie, państwo, państwu, państwo, państwowa, państwu, państwa, państw, państwowych, państwa, państwo, państwowych, państwie"
239,ostr,23,"ostrzega, ostrzega, ostrzega, ostrzał, ostrzał, ostrzał, ostrzał, ostrzeżenie, ostrzegają, ostrożność, ostrzega, ostrą, ostrzeżeniami, ostrzeżenia, ostrzeżenie, ostrzega, ostrzega, ostrzegają, ostrzegania, ostrzegania, ostrzał, ostrzału, ostrzał"
178,zagr,23,"zagrożeniem, zagrożeniem, zagrożeni, zagrożeni, zagrożeni, zagrożeni, zagrody, zagranie, zagranicznych, zagrożeń, zagrają, zagrożony, zagryziona, zagra, zagrożone, zagrali, zagrzewa, zagrażają, zagrażają, zagraża, zagranicy, zagraniem, zagranicy"
191,kto,23,"kto, kto, kto, kto, kto, kto, kto, kto, kto, kto, kto, kto, kto, kto, kto, kto, kto, kto, kto, kto, kto, kto, kto"
112,pomo,23,"pomoc, pomocy, pomocy, pomocy, pomocy, pomocy, pomocy, pomocy, pomoc, pomocy, pomogła, pomoc, pomoc, pomoc, pomoc, pomocy, pomoc, pomocy, pomoc, pomocy, pomoc, pomoc, pomoc"
222,znal,23,"znaleźli, znaleźli, znalazła, znaleźli, znaleźli, znaleziono, znalazł, znalezione, znalazła, znaleźli, znalezione, znaleziono, znalezione, znaleziono, znali, znaleziono, znali, znaleziono, znali, znaleziony, znaleziska, znaleźli, znaleziono"
22,auto,23,"autorytaryzmu, autorytaryzmu, autobusów, autostradą, autostradach, auto, auto, autografem, autokar, autostradzie, autobus, auto, automatyczny, autostrady, autobusy, autobusy, autobusy, autobusu, autobusami, autobus, auto, autostradowej, autostradzie"
297,szpi,23,"szpitala, szpiegów, szpiegowską, szpiegowska, szpiegowska, szpiegowska, szpiegowska, szpiegowska, szpiegowska, szpitala, szpiegowski, szpiegowski, szpital, szpiegowskich, szpitala, szpitala, szpitala, szpiegów, szpitalu, szpitalu, szpitala, szpitalu, szpilę"
619,aust,22,"australian, australian, australian, australian, australian, australian, australian, australian, australian, australian, australian, australian, australian, australian, australian, australian, australian, australian, australian, austrii, austrii, austrii"
504,ziem,22,"ziemi, ziemią, ziemią, ziemią, ziemią, ziemię, ziemią, ziemię, ziemia, ziemi, ziemi, ziemi, ziemi, ziemia, ziemi, ziemia, ziemię, ziemowit, ziemi, ziemi, ziemię, ziemi"
235,nieb,22,"niebezpieczna, niebezpieczna, niebezpieczeństwie, niebie, niebezpieczną, nieba, niebezpieczni, niebezpieczny, niebezpieczną, niebezpieczne, niebezpiecznych, niebezpiecznie, niebie, niebie, niebo, niebezpieczny, niebezpieczne, niebezpieczne, niebie, niebezpiecznie, niebezpieczna, niebieskie"
971,drug,22,"drugich, drugi, drugi, drugi, drugi, drugi, drugi, drugi, drugi, drugi, drugi, drugie, drugi, drugi, drugą, drugi, drugiego, druga, druga, druga, druga, drugi"
1516,plus,22,"plus, plus, plus, plus, plus, plus, plus, plus, plus, plus, plus, plus, plus, plus, plus, plus, plus, plus, plus, plus, plus, plus"
225,chci,22,"chciałem, chciałem, chciał, chciał, chciwość, chciwość, chciwość, chciwość, chciwość, chciwość, chciał, chciałbym, chciałabym, chciała, chciała, chciał, chciał, chciał, chciał, chciałbym, chciałabym, chciałby"
174,bez,22,"bez, bez, bez, bez, bez, bez, bez, bez, bez, bez, bez, bez, bez, bez, bez, bez, bez, bez, bez, bez, bez, bez"
175,proc,22,"procedura, procedura, procent, procentowych, proces, procentowych, procentowych, procentowych, procentowych, procentowych, procentowych, prochów, procent, procentowymi, proces, procentowych, procent, procent, procent, procentowych, procent, procedury"
50,ludz,21,"ludzi, ludzi, ludzie, ludzie, ludzi, ludzie, ludzie, ludzkich, ludzie, ludzi, ludzi, ludzie, ludzkości, ludzi, ludzi, ludzie, ludzi, ludzi, ludzie, ludzi, ludzi"
704,roku,21,"roku, roku, roku, roku, roku, roku, roku, roku, roku, roku, roku, roku, roku, roku, roku, roku, roku, roku, roku, roku, roku"
181,reko,21,"rekordowo, rekordowo, rekompensaty, rekordowym, rekordowe, rekordową, rekord, rekordzistka, rekordy, rekordy, rekord, rekordowo, rekompensaty, rekord, rekompensaty, rekord, rekompensaty, rekord, rekomendacji, rekord, rekordy"
